,filename,title,incident_start_time,incident_detected_time,incident_end_time,severity_level,summary,incident_duration,time_to_detect,time_to_resolve,services,service_impact_type,components,component_root_cause,impact,user_impact_type,root_cause,category_root_cause,symptom,symptom_type
139,2020-09-25_s5_replication_lag.wikitext,Database Replication Issue in Multiple Wikis,2020-09-25 11:55:00,2020-09-25 11:42:00,2020-09-25 12:25:00,Sev(3),"A number of s5 database replicas in the Eqiad and Codfw data centres alerted about replication being stopped due to a duplicate key, leading to watchlist and recentchanges delays.",00:30:00,23:47:00,00:43:00,"watchlist,recentchanges",MediaWiki Core Services,"s5 database,ipblocks",Databases,Editors of wikis hosted in the s5 section saw stale data in recentchanges and watchlist interfaces.,Cache Issues,"The incident was likely caused by a drift that was either there and touched by an inserted row or generated by MediaWiki through an unsafe statement like INSERT IGNORE, leading to duplicate key errors.","Database Issues, Software Bugs",Automated monitoring caught the issue and SRE was paged about stopped replication in a number of s5 replicas. The alerts were appropriate and pointed out the issue accurately.,Database Errors
140,2019-10-31_wikidata.wikitext,Wikidata API Call Timeouts Due to DB Read Load,2023-10-17 16:00:00,2023-10-17 16:38:00,2023-10-17 17:29:00,Sev(2),Wikidata API calls were getting timeouts due to increased DB read load caused by backported changes intended to reduce deadlocks around writing to the new terms store for Wikibase.,01:29:00,00:38:00,00:51:00,"Wikidata API,Wikidata API","API and Application Servers, Other","Wikibase,DB read operations,Wikibase",Databases,"Wikidata editors experienced timeouts to API requests, and API response times for writes increased significantly. Most edits initiated from API calls were made successfully, but clients did not receive confirmation responses.","Elevated Response Times and Latencies, API Failures","Backported changes intended to reduce deadlocks around writing to the new terms store caused an increased DB read load, resulting in timeouts for Wikidata API calls.","Database Issues, Configuration Errors",The issue was first detected by humans in a Telegram chat and was later confirmed by Addshore.,User Reported Problems
141,2023-01-17_asw-b2-codfw_failure_redux.wikitext,Codfw Row B Network Connectivity Incident,2023-01-17 13:00:00,2023-01-17 12:49:00,2023-01-17 17:17:00,Sev(3),All hosts in codfw row B lost network connectivity due to issues triggered by the prep work to bring a replacement switch online and a subsequent operator error.,04:17:00,23:49:00,04:28:00,"geoip,generic-map,restbase-async,mobileapps,swift,swift,thanos-query,recommendation-api,etcd,cassandra","Other, Other, API and Application Servers, API and Application Servers, Media Storage and File Handling, Media Storage and File Handling, Database and Data Analytics, API and Application Servers, Caching and Proxy Services, Database and Data Analytics","network switches,IPv6 connectivity,network switches,core routers",Networking Equipment,All hosts in codfw row B lost network connectivity. End-user impact is to be determined.,Network Connectivity Problems,"Two separate Junos bugs: one triggered by the prep work for a replacement switch, causing instability in connectivity between different switches, and another triggered by an operator error breaking IPv6 connectivity for the whole row.","Network Failures, Software Bugs, Configuration Errors",The issue was first detected at 12:49 UTC when LibreNMS alerts fired for a virtual-chassis crash on device asw-b-codfw.mgmt.codfw.wmnet.,"Network Connectivity Problems, Service Probes and Health Checks Failures"
142,2022-05-24_Failed_Apache_restart.wikitext,Incident Involving Puppet Change and Apache Restart,2023-01-01 11:45:00,2023-01-01 11:45:00,2023-01-01 12:16:00,Sev(2),"A Puppet change caused an Apache restart issue, leading to a small number of 502 HTTP errors for users and multiple IRC alerts.",00:31:00,00:00:00,00:31:00,"kibana7,Apache HTTP,network monitoring,MW app servers","Monitoring and Logging, API and Application Servers","apache2.service,apache2.service,puppet,cumin","Web Servers & Application Layers, Web Servers & Application Layers, Code Deployment & Version Control, Cluster Management",A very small amount of 502 HTTP errors for users (predominantly logged-in users). Plus some 140 IRC alerts for a subset of hosts running Apache.,"Increased Error Rates, API Failures",A Puppet change made Apache listen on port 443 regardless of whether mod_ssl was enabled.,Configuration Errors,"The issue was first detected by the engineer who merged the patch, followed by multiple IRC alerts and pager notifications.",User Reported Problems
143,2022-06-10_overload_varnish_haproxy.wikitext,Disruption in Wiki Traffic Across Multiple Regions,2022-06-10 14:57:00,2022-06-10 14:57:00,2022-06-10 15:00:00,Sev(2),"For 3 minutes, wiki traffic was disrupted in multiple regions at the CDN layer, leading to HTTP 5xx error responses for both cached and logged-in responses.",00:03:00,00:00:00,00:03:00,wiki traffic,Content Delivery Network (CDN) and Edge Cache,"CDN layer,CDN layer,HAProxy","Web Proxies, Caching Servers, Load Balancers",Users experienced service disruptions and HTTP 5xx error responses while trying to access wiki pages.,"Partial Service Outage, Increased Error Rates","Ongoing rate-limiting caused lots of HTTP 429 from Varnish, which resulted in an overload at the HAProxy level and general service disruption.",Capacity Overloads,"HTTP 503 errors were reported on Phabricator, with alerts triggered due to Varnish overload.","Cache Layer Anomalies, High CPU & Resource Utilization"
144,2022-08-24_swift.wikitext,Media Request Failures Resulting in Numerous HTTP Errors,TODO 00:00:00,TODO 00:00:00,TODO 00:06:00,Sev(2),"For approximately 17 hours, media requests (mostly thumbnail reads, but also uploads) failed at a rate of about 2000 HTTP errors per minute, causing significant disruption.",00:00:00,00:00:00,00:00:00,"upload.wikimedia.org,upload.wikimedia.org","Media Storage and File Handling, Other","media,media",Other,"Approximately 1.9 million uncached media requests to upload.wikimedia.org failed along with 609 unsuccessful upload attempts, which was particularly noticeable to Commons contributors.","Cache Issues, API Failures",The root cause is not specified in the provided incident report draft.,Other,The issue was detected due to media requests failing at a high rate of 2000 HTTP errors per minute.,"Latency and Timeout Issues, Network Connectivity Problems"
145,2020-01-08_mw-api.wikitext,MediaWiki EventBus TLS Configuration Incident,2020-01-08 15:06:00,2020-01-08 15:08:00,2020-01-08 16:00:00,Sev(3),"A configuration change making EventBus use TLS for eventgate-analytics led to POST requests from MediaWiki application servers timing out, causing HTTP server errors and widespread disruptions in all data centers.",00:54:00,00:02:00,00:52:00,"MediaWiki,EventBus,ATS,Varnish","MediaWiki Core Services, API and Application Servers, Caching and Proxy Services, Caching and Proxy Services","mediawiki.api-request,mediawiki.api-request,ATS-tls,varnish-fe","Web Servers & Application Layers, Web Servers & Application Layers, Web Proxies, Caching Servers","Between 15:06 and 15:32, ATS backend requests to application servers resulted in 3K to 7K 5xx errors per second. Many user requests received 502 error responses or no response at all. Additionally, analytics events in the mediawiki.api-request and mediawiki.cirrussearch-request streams were lost.","Partial Service Outage, Increased Error Rates, Data Corruption or Loss","The change to make EventBus use TLS for eventgate-analytics led to application server requests timing out, causing cascading failures across the stack.","TLS/SSL Issues, Configuration Errors","The issue was first detected by various Icinga PHP7 rendering alerts on IRC, followed by multiple pages about api.svc.eqiad.wmnet socket timeouts, ATS TLS, and Varnish reduced availability.","Latency and Timeout Issues, Service Probes and Health Checks Failures, Cache Layer Anomalies"
146,2023-06-06 dawiktionary dawiki svwiktionary partial outage.wikitext,"Partial Outage Impacting dawiktionary, dawiki, and svwiktionary",2023-06-06 00:30:00,2023-06-06 01:35:00,2023-06-06 03:49:00,Sev(3),"All users of dawiktionary, dawiki, and svwiktionary sometimes received fatal exceptions while browsing due to a data issue related to a data migration implementation bug.",03:19:00,01:05:00,02:14:00,"dawiktionary,dawiktionary,dawiktionary",Other,"object cache,object cache,data migration",Other,"All users of dawiktionary, dawiki, and svwiktionary sometimes received fatal exceptions while browsing.",Increased Error Rates,"A data migration implementation bug in how bash interprets double-quotes ("") characters caused a data issue that entered the object cache.",Software Bugs,The issue was first detected by a volunteer who noticed errors and reported them via IRC. Another volunteer escalated the issue to SRE via Klaxon.,User Reported Problems
147,2022-03-04_esams_availability_banner_sampling.wikitext,Wiki Unreachability Due to CentralNotice Banner Deployment,2022-03-04 09:18:00,2022-03-04 09:18:00,2022-03-04 10:47:53,Sev(3),"A banner deployed via CentralNotice with a 100% sampling rate caused instabilities in the traffic layer, making wikis largely unreachable in Europe and intermittently affecting other global regions.",01:29:53,00:00:00,01:29:53,"wikis,eventgate-analytics-external",Other,"Varnish,CentralNotice,Esams datacenter,Esams datacenter","Web Proxies, Caching Servers, Other, Other","For 1.5 hours, wikis were largely unreachable from Europe (via Esams) with shorter and more limited impact across the globe via other data centers.","Partial Service Outage, Network Connectivity Problems","A banner was deployed with a 100% sampling rate for event instrumentation, causing a large amount of incoming traffic for event beacons that overwhelmed the Varnish system.",Capacity Overloads,"The issue was first detected through instabilities at the traffic layer, where connections for event beacons piled up, leading to Varnish being unable to handle traffic. Initial impact was observed in the Esams datacenter.","Network Connectivity Problems, Cache Layer Anomalies"
148,2022-12-18_World_Cup.wikitext,API Outage Due to DiscussionTools Extension and Increased Traffic,2022-12-18 17:58:00,2022-12-18 17:59:00,2022-12-18 18:22:00,Sev(3),"For approximately 24 minutes, uncached calls to the API on the eqiad datacenter overloaded the application servers, causing unreasonable latency or failing to respond to requests. Elevated latencies persisted for the following 3 hours as traffic load organically went down.",00:24:00,00:01:00,00:23:00,"API,Parsoid,Frontend (HAProxy,Frontend (HAProxy","API and Application Servers, Caching and Proxy Services","MediaWiki Application Servers,DiscussionTools MediaWiki Extension,DiscussionTools MediaWiki Extension",Web Servers & Application Layers,"All API users experienced 5XX errors (11-12 thousand errors per second) or unreasonable latencies for 24 minutes. After that, there was degraded performance with increased but more reasonable latency for around 3 hours.","API Failures, Elevated Response Times and Latencies, Increased Error Rates","The DiscussionTools MediaWiki extension added a ResourceLoader module on almost all page views, creating an API call. Combined with a significant 50% increase in overall traffic, this led to an overload and increased latencies on the API cluster.","Capacity Overloads, Unexpected Traffic Surges","Monitoring and paging worked as intended, triggering alerts such as PHPFPMTooBusy and FrontendUnavailable at around 17:59 UTC.","Appserver Issues, High CPU & Resource Utilization"
149,2020-04-07_Wikidata%27s_wb_items_per_site_table_dropped.wikitext,Wikidata wb_items_per_site Table Incident Review,2020-04-06 23:02:00,2020-04-06 23:03:57,2020-04-06 23:26:00,Sev(3),"A misconfigured cron script led to the dropping of Wikidata's `wb_items_per_site` table, causing significant disruptions to page renders and edits for 20 minutes, and ongoing metadata issues for 19 hours.",00:24:00,00:01:57,00:22:03,"MediaWiki,MediaWiki","MediaWiki Core Services, Wikidata Query Service","wb_items_per_site table,update.php,update.php,cron/wikibase/dumpwikibaserdf.sh,wb_items_per_site table","Databases, Code Deployment & Version Control","Almost all content page parses were broken for 20 minutes, showing database error messages. This disruption affected many page views for logged-in users and many edits. For 19 hours, users encountered incorrect metadata, and hundreds of duplicate items in Wikidata.","Complete Service Outage, Data Corruption or Loss","Wikidata's `wb_items_per_site` table was dropped by a misconfigured weekly cron script running `update.php`, which had been misconfigured for eight years to drop this table.",Configuration Errors,First detected by a user report indicating a database error at 23:03:09 UTC and followed by an automated alert at 23:05:33 UTC reporting MediaWiki exceptions and fatals per minute reached critical levels.,"User Reported Problems, Database Errors"
150,2023-03-09_mailman.wikitext,Mailman Outage Due to Network Maintenance,2023-03-07 14:35:00,2023-03-07 14:43:00,2023-03-09 23:34:00,Sev(2),"During network maintenance, the Mailman runner process for delivering outgoing emails crashed and was not automatically restarted. Mailman queued outgoing emails for two days until the issue was resolved.",56:59:00,00:08:00,56:51:00,"Mailing Lists,Mailing Lists,Mailing Lists,Mailing Lists",Other,"Mailman runner process,MariaDB database server,Mailman runner process,network switches at eqiad row A,Mailman runner process","Other, Databases, Other, Networking Equipment, Other","For 2 days, Mailman did not deliver any mail, affecting public and private community, affiliate, and WMF mailing lists.","Partial Service Outage, Elevated Response Times and Latencies",The Mailman runner process crashed due to being unable to connect to the MariaDB database server and was not automatically restarted.,"Database Issues, Software Bugs","Automated monitoring through icinga detected the issue with an alert: '<+icinga-wm> PROBLEM - mailman3_runners on lists1001 is CRITICAL: PROCS CRITICAL: 13 processes with UID = 38 (list), regex args /usr/lib/mailman3/bin/runner' but it was not noticed by humans until a Gerrit Reviewer Bot report almost 2 days later.",Service Probes and Health Checks Failures
151,2023-05-30_Unintentional_%2B2_on_a_config_patch_without_deployment.wikitext,Incident: Accidental +2 on mediawiki-config Patch,2023-05-30 10:00:00,2023-05-30 10:00:00,2023-05-30 10:01:00,Sev(2),"A patch to mediawiki-config was accidentally +2'd and not immediately deployed, which could have led to confusion for a future deployer.",00:01:00,00:00:00,00:01:00,mediawiki-config,MediaWiki Core Services,"Patch Deployment,Gerrit",Other,A patch to mediawiki-config was accidentally +2'd and not immediately deployed.,Other,"A patch was accidentally +2'd without intent to deploy, similar to how one might on a software repo rather than a config repo.",Configuration Errors,The issue was first detected when https://gerrit.wikimedia.org/r/c/operations/mediawiki-config/+/923650 was +2'd and then reverted by an observer within a minute.,Other
152,2019-09-23_s3_primary_db_master_crash.wikitext,S3 Primary Database Master Outage,2019-09-22 18:40:38,2019-09-22 18:42:45,2019-09-22 19:16:00,Sev(3),s3 primary database master experienced a RAID backup battery failure causing the host to crash and requiring a power cycle from the iDRAC.,00:35:22,00:02:07,00:33:15,s3 wikis,Cloud Services and Virtual Private Servers (VPS),"db1075,RAID backup battery","Databases, Other",All the s3 wikis went read-only as the master wasn't available for writes. Reads were not affected as all the replicas were available.,Partial Service Outage,"The master lost its BBU, resulting in a complete host crash, an issue previously encountered with HP hosts.",Hardware Failures,"The issue was first detected when db1075 reported HOST DOWN. Alerts were sent to IRC and pages were issued, and users reported issues on #wikimedia-operations.","Database Errors, User Reported Problems"
153,2020-06-04_cloud-private-repo.wikitext,Incident: Change Deployed to Puppet Causes Secrets Deletion,2020-06-04 10:12:00,2020-06-04 12:37:00,2020-06-04 16:40:00,Sev(2),"A change deployed to puppet inadvertently deleted the private repo from all puppet backend and standalone servers, causing the deletion of all secrets and necessitating manual restoration.",06:28:00,02:25:00,04:03:00,"Cloud Services,Puppet Backend Servers,Puppet Backend Servers","Cloud Services and Virtual Private Servers (VPS), Other","labs/private repo,tools-puppetmaster-02,integration/deployment-prep,labs/private repo,tools-puppetmaster-02,docker,acme-chief,k8s/kubeadm","Monitoring & Telemetry, Caching Servers, Cluster Management, Code Deployment & Version Control, Databases, Containers & Kubernetes",Any cloud environments that had added private secrets reverted to using the dummy secrets in the labs/private repo.,Security Incidents,"The change was merged without realizing it would remove the private repo from the puppet backend and standalone servers, and the engineer performing the change was unaware of the importance of the private repository.","Configuration Errors, Other",The issue was first detected by a member of the Cloud Services team when they noticed missing data in the tools private repo and inquired about recent changes.,User Reported Problems
154,2023-02-22_wiki_outage.wikitext,HAProxy Upgrade Issue on Cache Hosts,2023-02-22 09:18:00,,2023-02-22 09:45:00,Sev(3),"During routine maintenance to upgrade HAProxy on cache hosts, an accidental depooling of backends caused significant traffic to fail, resulting in errors for clients.",00:27:00,00:00:00,00:00:00,"Phabricator,Phabricator,Grafana",Other,"varnish-text,varnish-text,varnish-text,varnish-text,varnish-text",Caching Servers,"For approximately 18 minutes, around 17% of incoming non-multimedia Wikimedia traffic received 503 or 500 errors or were missing, primarily affecting users in Europe, Africa, and Asia.","Partial Service Outage, Increased Error Rates, Network Connectivity Problems",A mismatch during the maintenance run between depooling hosts individually and pooling back the CDN led to all ATS backends in the text cache cluster being accidentally depooled.,Configuration Errors,"Automated alerts/page fired (FrontendUnavailable), including alerts for cache_text, varnish-text, and multiple ProbeDown incidents.","Service Probes and Health Checks Failures, Cache Layer Anomalies"
155,2022-07-11_FrontendUnavailable_cache_text.wikitext,MediaWiki API Cluster Latency and Error Incident,2022-07-11 19:30:00,2022-07-11 19:30:00,2022-07-11 19:36:00,Sev(2),"For 5 minutes, the MediaWiki API cluster in eqiad responded with higher latencies or errors to clients.",00:06:00,00:00:00,00:06:00,MediaWiki API,API and Application Servers,"PHP workers,database host (db1132),database host (db1132)","Databases, Web Servers & Application Layers",Users experienced increased latency and errors when accessing the MediaWiki API cluster.,"Elevated Response Times and Latencies, Increased Error Rates, API Failures","An increase in requests to the API cluster reduced the available PHP workers and exhausted connections on a MariaDB 10.6 database host (db1132), which is sensitive to high load.","Unexpected Traffic Surges, Capacity Overloads",The issue was first detected through an increase in latency and errors returned to clients. No specific alert details were provided.,"Latency and Timeout Issues, User Reported Problems"
156,2022-05-31_Analytics_Hadoop_failure.wikitext,Hadoop HDFS NameNode Failure Incident,2022-05-31 17:09:10,2022-05-31 17:09:10,2022-05-31 18:00:00,Sev(2),A failure in the Hadoop HDFS NameNode on both the primary and standby servers caused all HDFS writes and reads to fail. This incident was resolved without any lasting impact or data loss.,00:50:50,00:00:00,00:50:50,"Big Data Services,Big Data Services,Big Data Services,Data Visualization Tools,Data Visualization Tools,Big Data Services,Ingestion Services",Database and Data Analytics,"Hadoop HDFS NameNode,Hadoop HDFS NameNode,Hadoop HDFS NameNode,Hadoop HDFS NameNode",Databases,"There was no public-facing impact. Users within the WMF data teams who use tools such as Hive, Spark, Jupyter, Superset, etc., were affected. Several scheduled ingestion pipelines that read from or write to HDFS were also disrupted during the incident.","Partial Service Outage, Storage and Database Failures","The incident was caused by the primary and standby NameNodes crashing due to the `/var/lib/hadoop/journal` directories on all journal nodes becoming completely filled. This was traced back to a backup job issue where the standby NameNode was unable to save its image, causing journal nodes to fill up their partitions over time.","Capacity Overloads, Software Bugs",The issue was first detected through an email alert received at Tue May 31 17:09:10 UTC 2022 with the subject 'At least one Hadoop HDFS NameNode is active is CRITICAL'.,Service Probes and Health Checks Failures
157,2022-07-12_codfw_A5_powercycle.wikitext,Power Outage During PDU Maintenance in Rack A5,2022-07-12 15:45:00,2022-07-12 15:45:00,2022-07-12 16:00:00,Sev(2),"During the scheduled maintenance to upgrade the PDUs in rack A5, CyrusOne mistakenly flipped the incorrect breaker, resulting in all servers in rack A5 losing power to both primary and secondary power feeds. The issue was resolved once the breaker was flipped back on.",00:15:00,00:00:00,00:15:00,"Ganeti VMs,MariaDB,Graphite","Cloud Services and Virtual Private Servers (VPS), Database and Data Analytics, Monitoring and Logging","PDU,graphite2003,maps2005,db2079,db2079","Other, Monitoring & Telemetry, Web Servers & Application Layers, Databases, Databases","No apparent user-facing impact, but lots of internal clean up, e.g. for Ganeti VMs.",Other,"CyrusOne flipped the incorrect breaker on the breaker panel during scheduled maintenance to upgrade the PDUs, causing a loss of power to all servers in rack A5.",Hardware Failures,"The issue was first detected by multiple alerts indicating critical packet loss and database connectivity issues:
* 15:45 <+icinga-wm> PROBLEM - Host graphite2003 #page is DOWN: PING CRITICAL - Packet loss = 100%
* 15:45 <+icinga-wm> PROBLEM - Host maps2005 is DOWN: PING CRITICAL - Packet loss = 100%
* 15:55 <+icinga-wm> PROBLEM - MariaDB read only s8 #page on db2079 is CRITICAL: Could not connect to localhost:3306
* 15:56 <+icinga-wm> PROBLEM - MariaDB read only m1 #page on db2132 is CRITICAL: Could not connect to localhost:3306
* 16:00 <+icinga-wm> RECOVERY - MariaDB read only s8 #page on db2079 is OK","Network Connectivity Problems, Database Errors"
158,2021-09-18_appserver_latency.wikitext,Slow Database Queries Resulting in php-fpm Worker Exhaustion,2021-09-05 00:00:00,2021-09-05 00:00:00,2021-09-05 00:10:00,Sev(2),Slow database queries resulted in php-fpm worker exhaustion.,00:10:00,00:00:00,00:10:00,"General Services,General Services,General Services",Other,"php-fpm,CDN Cache","Web Servers & Application Layers, Caching Servers","For about 10 minutes, backends were slow or unavailable for all wikis. This affected logged-in users, most bots/API queries, and some page views from unregistered users (pages that were recently edited or otherwise expired from the CDN cache).","Partial Service Outage, Elevated Response Times and Latencies",Slow database queries,Database Issues,Issue was first detected due to php-fpm worker exhaustion.,Appserver Issues
159,2019-08-02_api-overload-parsoid.wikitext,"API Appserver Cluster Parsoid-Batch Calls Overwhelm (Aug 5, 2019)",2019-08-05 07:00:00,2019-08-05 07:00:00,2019-08-05 15:34:00,Sev(2),The api-appserver cluster experienced brownouts and frontend availability dropped to ~97% due to expensive parsoid-batch calls from certain pages.,08:34:00,00:00:00,08:34:00,"API,services,API,API,services,services","API and Application Servers, Other","api-appserver cluster,parsoid-batch requests,mw12[23].*",Web Servers & Application Layers,"The mediawiki API was heavily impacted, affecting internal services and external API users. A notable slowdown led to a decrease in request rates.","Elevated Response Times and Latencies, API Failures","API appservers were overwhelmed by a storm of long-running parsoid-batch requests, particularly from external requests, which exhausted the cluster's resources.","Capacity Overloads, Unexpected Traffic Surges","High CPU load alerts for appservers were triggered on IRC during brownouts from 6-12 UTC, followed by widespread alerts for affected internal systems starting around 15 UTC.",High CPU & Resource Utilization
