,filename,title,incident_start_time,incident_detected_time,incident_end_time,severity_level,summary,incident_duration,time_to_detect,time_to_resolve,services,service_impact_type,components,component_root_cause,impact,user_impact_type,root_cause,category_root_cause,symptom,symptom_type
94,2022-02-22_wdqs_updater_codfw.wikitext,WDQS Update Failure Due to Flink in Codfw,2022-02-22 17:47:00,2022-02-22 19:00:00,2022-02-22 19:27:00,Sev(3),WDQS updaters stopped processing updates in Codfw due to a failure with Flink in Codfw.,01:40:00,01:13:00,00:27:00,"Wikidata,Wikidata","Wikidata Query Service, MediaWiki Core Services","updateQueryServiceLag,updateQueryServiceLag,updateQueryServiceLag",Other,"For about two hours, WDQS updates failed to be processed. As a consequence, bots and tools were unable to edit Wikidata during this time.","API Failures, Partial Service Outage","The root cause was a poor implementation of the swift client protocol, which prevented Flink from starting properly in Kubernetes. Switching to an S3 client resolved the issue.",Software Bugs,"The issue was first detected when the Wikidata maxlag alert was triggered at 19:00, even though Codfw was depooled.","Latency and Timeout Issues, Service Probes and Health Checks Failures"
95,2022-02-06_wdqs_updater.wikitext,WDQS Updater Failure Incident,2022-02-06 23:00:00,2022-02-06 23:00:00,2022-02-07 06:20:00,Sev(2),"The streaming updater stopped functioning due to a misbehaving Kubernetes node, affecting WDQS updates for about 7 hours.",07:20:00,00:00:00,07:20:00,"Wikidata,Wikidata","Wikidata Query Service, MediaWiki Core Services","streaming updater,k8s,flink session cluster,k8s,k8s",Containers & Kubernetes,"For about 7 hours, WDQS updates failed to be processed. As a consequence, bots and tools were unable to edit Wikidata during this time.","Partial Service Outage, API Failures","A Kubernetes node (kubernetes1014) misbehaved, causing resource starvation and preventing the streaming updater from functioning properly.","Hardware Failures, Software Bugs","The issue was first detected through rising WDQS lag in eqiad, which caused edits to be throttled. Metrics from Flink and Kubernetes indicated discrepancies in task slots and active PODs.","Appserver Issues, Database Errors, Latency and Timeout Issues, High CPU & Resource Utilization"
96,2022-08-26_Phabricator_login_issues.wikitext,Phabricator Session Cookie Removal Incident,2022-08-26 09:56:00,2022-08-26 10:07:00,2022-08-26 10:13:00,Sev(2),"On August 26, 2022, a test change in cp6016 prevented session cookies from reaching the service's origin server, causing users to be logged out and unable to log back in for approximately 17 minutes.",00:17:00,00:11:00,00:06:00,"Wikimedia services,Wikimedia services",Other,"session cookies,ATS layer,cp6016",Other,"For approximately 17 minutes, some users accessing Wikimedia services experienced automatic logouts and were unable to log in, affecting logged actions. The most noticeable impact was on Phabricator.","Partial Service Outage, Security Incidents","An ATS bug/misdocumented feature caused session cookies to be wiped during the execution of specific hooks, preventing them from reaching the origin server.",Software Bugs,"The issue was first detected by several people on IRC in the SRE channel who noticed being logged out from Phabricator after any action, with no alerts being sent as it only affected logged-in users.",User Reported Problems
97,2021-06-29_trwikivoyage_primary_db.wikitext,Turkish Wikivoyage Outage due to Database Configuration Error,2021-06-29 14:22:00,2021-06-29 14:26:11,2021-06-29 14:30:00,Sev(2),"Shortly after the June 2021 switch over, the backend appservers were unable to serve requests to tr.wikivoyage.org for about 8 minutes from 14:22 UTC to 14:30 UTC. No other wikis were affected.",00:08:00,00:04:11,00:03:49,Turkish Wikivoyage,Other,"Backend Appservers,Infrastructure,Primary Database,Infrastructure","Web Servers & Application Layers, Caching Servers, Databases, Other","For 8 minutes, registered users on the Turkish Wikivoyage were consistently unable to load any pages or perform any actions. The general public may have noticed it to a lesser extent due to caching at our CDN layer, although any pages absent from the CDN cache would have also been temporarily unavailable.","Complete Service Outage, Cache Issues","The assignment for Codfw datacenter contained a typo, which caused MediaWiki to look for the trwikivoyage database in the s3 cluster instead of s5. This typo was not spotted in code review, and the configuration key was not subject to data validation, leading to unavailability when traffic was switched to Codfw.",Configuration Errors,"The issue was first detected through PHP Fatal Errors for backend requests to tr.wikivoyage.org, found through Logstash and detectable with alerts from the Prometheus metrics for error logs.","Appserver Issues, User Reported Problems"
98,2021-11-18_codfw_ipv6_network.wikitext,2021-11-18 Codfw IPv6 Network Incident,YYYY-MM-DD hh:mm:ss,YYYY-MM-DD hh:mm:ss,YYYY-MM-DD hh:mm:ss,Sev(2),"For 8 minutes, the Codfw cluster experienced partial loss of IPv6 connectivity for upload.wikimedia.org, with no visible user impact due to Happy Eyeballs.",00:00:00,00:00:00,00:00:00,upload.wikimedia.org,Media Storage and File Handling,"Codfw cluster,Codfw cluster,Codfw cluster,Codfw cluster,Codfw cluster,Junos (switch operating system)",Networking Equipment,"For 8 minutes, the Codfw cluster experienced partial loss of IPv6 connectivity for upload.wikimedia.org. The Codfw cluster generally serves Mexico and parts of the US and Canada. The upload.wikimedia.org service serves photos and other media/document files, such as displayed in Wikipedia articles.","Partial Service Outage, Network Connectivity Problems","The new switch installed to replace the one showing signs of disk failure was silently discarding IPv6 traffic, which was later identified as a Junos (switch operating system) bug that was resolved by forcing a virtual-chassis master failover.","Hardware Failures, Software Bugs","Monitoring triggered and the interface between asw-b7-codfw and cr2-codfw was disabled, forcing traffic through the cr1<->asw-b2-codfw link, resolving the upload-lb issue.",Network Connectivity Problems
99,2021-02-26_sudo.wikitext,Incident Involving Syntax Error in /etc/sudoers File Affecting Puppet and Nagios,2021-02-25 09:00:00,2021-02-25 08:51:00,2021-02-25 14:05:00,Sev(2),"A patch was merged and deployed to all hosts containing a syntax error in the /etc/sudoers file, causing sudo to not work and creating numerous alert emails and mail delivery delays.",05:05:00,23:51:00,05:14:00,"Puppet,Nagios,Mail Delivery",Other,"puppet-merge,puppet-merge,root@wikimedia.org Email,mx1001,mx1001",Other,"Users were unable to use sudo, Nagios alert execution was impacted, and there was a significant overload and delay in mail delivery.","Partial Service Outage, Elevated Response Times and Latencies",A syntax error in the /etc/sudoers file introduced by a new patch.,Configuration Errors,The issue was first detected when people reported on IRC that they were unable to use sudo due to a parse error in /etc/sudoers. Hundreds of alert emails started arriving due to sudo failures.,"Security Vulnerabilities, User Reported Problems"
100,2022-07-10_thumbor.wikitext,Thumbor Service Response Time Regression Incident,,,,Sev(2),"For several days, Thumbor p75 service response times gradually regressed by several seconds. Due to an upstream bug introduced in a firejail update, Thumbor constantly restarted itself, leading to increased error rates and delays from HAProxy.",00:00:00,00:00:00,00:00:00,"Thumbor,HAProxy","Media Storage and File Handling, Caching and Proxy Services","Thumbor,firejail",Other,"Thumbor p75 service response times regressed by several seconds, leading to increased error rates and delays, thus affecting the user experience negatively.","Elevated Response Times and Latencies, Increased Error Rates",An upstream bug introduced in a firejail update caused Thumbor to constantly restart itself.,Software Bugs,"The symptom details are not provided in the supplied incident report, but it notes an increased service response time and error rates.","Latency and Timeout Issues, User Reported Problems"
101,2020-07-03_Lilypond_down.wikitext,Lilypond Bypassing Security Restrictions Incident,,,,Sev(2),Lilypond bypassed security restrictions.,00:00:00,00:00:00,00:00:00,,Other,wmf-config settings,Other,Users may have faced vulnerabilities due to the bypassing of security restrictions.,Security Incidents,Lilypond was able to bypass existing security restrictions.,Security Misconfigurations,The issue was detected through internal security audits that identified the bypass.,Security Vulnerabilities
102,2019-09-13_maps.wikitext,Map Servers CPU Saturation Incident on September 13,2019-09-13 04:20:00,2019-09-13 04:26:00,2019-09-13 14:30:00,Sev(3),"On Friday, September 13, map servers experienced CPU saturation due to poorly formed requests, leading to partial unavailability of maps from ~4:30 UTC to ~14:30 UTC. The issue was resolved by validating traffic at the caching layer.",10:10:00,00:06:00,10:04:00,"maps,maps",Other,"maps servers,varnish,maps servers,tilerator,nginx","Web Servers & Application Layers, Caching Servers, Web Servers & Application Layers, Web Servers & Application Layers, Web Servers & Application Layers","Service was degraded for ~9 hours. Approximately 2% of requests were affected, although most users likely experienced some degradation due to the high number of tiles seen during a session.","Partial Service Outage, Elevated Response Times and Latencies","A bug was introduced when fixing linting issues to integrate the CI pipeline, causing a failure in the HTTP error handler. This made Kartotherian unable to validate request parameters, resulting in high CPU usage and timeouts.",Software Bugs,"HTTP availability for Varnish was flapping starting 4:26 UTC and worsening by 6:49 UTC. No page was sent, and there was no direct alert specifically pointing to maps/Kartotherian.","Appserver Issues, Cache Layer Anomalies, Network Connectivity Problems"
103,2021-09-04_appserver_latency.wikitext,Database Server Load Increase Causing Query Delays,2021-09-04 19:30:00,2021-09-04 19:30:00,2021-09-04 20:07:00,Sev(2),"An increase in load on a database server led to slower query responses, causing backend traffic to occupy appserver php-fpm workers longer, resulting in a proportion of requests failing with an error message.",00:37:00,00:00:00,00:37:00,"backend,backend,CDN cache","Other, API and Application Servers, Content Delivery Network (CDN) and Edge Cache","php-fpm,database server","Web Servers & Application Layers, Databases","For 37 minutes, backends were slow (taking several seconds to respond) and 2% of requests failed entirely, affecting logged-in users, most bots/API queries, and some page views from unregistered users for pages that were recently edited or otherwise expired from the CDN cache.","Elevated Response Times and Latencies, Increased Error Rates, Cache Issues",An increase in load on a database server.,Capacity Overloads,"Slowness was first detected when many queries were responding much slower, and failed requests displayed an error page with the message 'upstream connect error or disconnect/reset before headers. reset reason: overflow'.","Database Errors, Latency and Timeout Issues, Network Connectivity Problems"
104,2020-10-06_cloud-vps.wikitext,Sensitive Credentials Leak via Publicly Accessible Memcached Servers,2020-10-09 02:21:00,2020-10-09 02:21:00,2020-10-09 08:43:00,Sev(3),"Sensitive credentials (authentication tokens) were leaked via publicly accessible memcached servers, allowing potential privilege escalation within Cloud VPS/Toolforge.",06:22:00,00:00:00,06:22:00,"Cloud Services,Developer Tools",Cloud Services and Virtual Private Servers (VPS),"Keystone API,memcached servers",Other,"Tokens could be used to escalate privileges, potentially allowing malicious cloud users to manipulate the Keystone API and perform actions like creating and destroying arbitrary VMs within Cloud VPS.",Security Incidents,"Memcached servers were accessible on a default port and without authentication, leading to the exposure of sensitive credentials.",Security Misconfigurations,"The breach was first detected due to tokens being leaked through publicly accessible memcached servers. Access was subsequently blocked in eqiad and codfw, and Keystone auth tokens were manually rotated.",Security Vulnerabilities
105,2019-12-11_MachineVision%2Bcpjobqueue.wikitext,Job Queue Blocked by Image Annotation Requests (MachineVision),2019-12-11 20:39:00,2019-12-12 00:05:00,2019-12-17 01:25:00,Sev(3),"Between 2019-12-11 and 2019-12-17, the job queue was blocked by image annotation request jobs enqueued by the MachineVision extension, causing severe delays in job processing.",124:46:00,03:26:00,121:20:00,"Global renames,Global renames,Echo notifications,File uploads,MassMessages,MassMessages,MassMessages","MediaWiki Core Services, Other","MachineVision extension,job specification interface,job specification interface",Other,"This delayed the execution of a wide variety of tasks that rely on the job queue, including global renames, deleting translatable pages, Echo notifications, file uploads, recent changes processing, MassMessages, and pageview data publication.",Elevated Response Times and Latencies,"The use of the release timestamp feature by the MachineVision extension in the job specification interface, which is not well supported by the Kafka job queue, leading to blocking waits.","Software Bugs, Configuration Errors","The issue was first reported by user 1997kB in Phabricator concerning delayed global renames, followed by additional reports of delayed functionality. No automated alerts detected the issue.","User Reported Problems, Latency and Timeout Issues"
106,2020-07-14_termbox_and_wikifeeds_timeouts.wikitext,Incidents with MediaWiki API Virtual Hosts due to Unconditional HTTPS Redirects,2020-07-13 19:33:00,2020-07-14 06:03:00,2020-07-14 11:25:00,Sev(3),The deployment of unconditional HTTPS redirects led to HTTP 302 redirects causing timeouts in Termbox and Wikifeeds requests due to Kubernetes cluster restrictions.,15:52:00,10:30:00,05:22:00,"Termbox,Wikifeeds",API and Application Servers,"Kubernetes Clusters,Kubernetes Clusters,HTTPS edge","Web Servers & Application Layers, Containers & Kubernetes, Networking Equipment","During a ~15 hour outage, around 12% of Termbox requests failed with HTTP 500 (~186,000 requests) and approximately 1,250,000 Wikifeeds requests timed out, though user impact was minimized due to two layers of caching.","Partial Service Outage, Increased Error Rates, Elevated Response Times and Latencies","Unconditional HTTPS redirects deployed, causing HTTP 302 redirects for requests missing the 'X-Forwarded-Proto: https' header, leading to timeouts when attempting to contact MediaWiki via the edge due to Kubernetes cluster egress restrictions.",Configuration Errors,High latency in restbase recognized by an SRE and Icinga alerts indicating the Wikipedia mobile app main page was not loading.,"Latency and Timeout Issues, Service Probes and Health Checks Failures"
107,2023-01-30_kartotherian.wikitext,Kartotherian Service Outage due to Deployment Rollback Failure,2023-01-30 12:46:00,2023-01-30 12:27:00,2023-01-30 13:31:00,Sev(3),"An upgrade to Kartotherian caused spurious Icinga alerts, leading to a rollback that failed due to non-robust configuration templates, resulting in an outage of the maps service.",00:45:00,23:41:00,01:04:00,Maps,Other,"Kartotherian,deployment configuration templates","Web Servers & Application Layers, Code Deployment & Version Control",No maps were rendered during the outage.,Partial Service Outage,"Non-robustness in the Kartotherian deployment configuration templates, which failed when deploying without the '--env' flag.",Configuration Errors,"Icinga alerts for 'kartotherian endpoints health' in #wikimedia-operations, detecting unusual template variables in URLs and unexpected status codes. For example, an alert in Icinga reported: 'Test Untitled test returned the unexpected status 301 (expecting: 200)', among others.",Service Probes and Health Checks Failures
108,2022-08-16_x2_databases_replication_breakage.wikitext,MediaWiki MainStash Replication Break Incident,2022-08-16 04:07:58,2022-08-16 03:08:12,2022-08-16 04:43:22,Sev(2),"Replication broke between local MainStash databases, causing user-noticeable exceptions during edit-related activities due to a previously undiscovered bug in MediaWiki's handling of replica failures.",00:35:24,23:00:14,01:35:10,"MediaWiki,MainStash","MediaWiki Core Services, Caching and Proxy Services","x2 database section,MediaWiki shutdown handler,x2 database section,ChronologyProtector,cross-dc replication","Databases, Other","For 36 minutes, errors were noticeable for some editors during edit-related actions, although saving edits was unaffected. Approximately 1 hour of volatile cache data was lost.","Partial Service Outage, Cache Issues","A previously undiscovered bug in how MediaWiki handles failures of local MainStash replicas, combined with improper replication and ChronologyProtector configuration, led to user-noticeable errors.","Software Bugs, Configuration Errors","The issue was first detected through 2 alert pages sent as soon as internal replication broke on the primary x2 servers, prompting further pages about the replicas and user reports of errors during edit-related activities.","Database Errors, User Reported Problems"
109,2021-09-13_cirrussearch_restart.wikitext,Impact of Puppet Change on Cirrus Elasticsearch System,2021-09-13 16:29:00,2021-09-13 16:29:00,2021-09-13 18:34:00,Sev(3),"Applying a change to the cirrus elasticsearch systemd unit triggered puppet to restart elasticsearch services, leading to cluster instability and cascading failures. Full recovery took approximately 2 hours and 5 minutes.",02:05:00,00:00:00,02:05:00,"en.wikipedia.org,API opensearch",Other,"Elasticsearch,puppet-agent,Elasticsearch,PyBal,MediaWiki api_appserver,PoolCounter","Databases, Monitoring & Telemetry, Web Servers & Application Layers, Load Balancers",For about 2 hours (from 16:29 until 18:34) search requests on en.wikipedia.org (and likely other wikis) failed with 'An error has occurred while searching: Search is currently too busy. Please try again later.' Search suggestions from API opensearch were absent or delayed. The api_appserver cluster saw higher average latency due to the proportion of search queries.,"Partial Service Outage, Elevated Response Times and Latencies, Increased Error Rates, API Failures","A change in the cirrus elasticsearch systemd unit triggered puppet to restart the elasticsearch services on multiple hosts simultaneously, causing cluster instability and a cascading failure scenario.","Configuration Errors, Software Bugs","The issue was first detected with a 'PyBal backends health check' alert indicating critical issues with elasticsearch hosts, followed by an 'ElasticSearch health check' for shards showing critical status, and the 'production-search-codfw' cluster dropping into red status.","Service Probes and Health Checks Failures, Network Connectivity Problems, Cache Layer Anomalies"
110,2020-05-11_thumbor.wikitext,Thumbor Service Incident due to High Volume of Requests,2020-05-11 12:11:00,2020-05-11 12:47:00,2020-05-11 13:26:00,Sev(3),"An external client issued a large number of requests for nonexistent images on commons, causing the thumbor service to return 503 errors and triggering an alert.",01:15:00,00:36:00,00:39:00,thumbor,Media Storage and File Handling,"eqiad,esams,haproxy,swift,haproxy","Databases, Web Proxies, Caching Servers, Load Balancers, Networking Equipment","Approximately 291,000 image thumbnailing/resizing requests failed and were returned as 503 errors, affecting users primarily in Europe and the East Coast of the American Continents.","Partial Service Outage, Increased Error Rates","The per-IP throttling in Thumbor was inadequate, allowing a single client to overload the service by keeping many workers busy with excessive requests.","Capacity Overloads, Configuration Errors","The issue was detected 40 minutes after it began when icinga paged the team, alerting about the entirety of the service. Graphs showed a spike in 404 and 503 errors, and latencies increased significantly.","Latency and Timeout Issues, Service Probes and Health Checks Failures, User Reported Problems"
111,2020-07-23_wdqs-outage.wikitext,Wikidata Query Service Outage,2020-07-23 17:11:00,2020-07-23 17:24:00,2020-07-23 18:44:00,Sev(2),"Various Wikidata Query Service instances were down due to failing readiness probes, with errors in blazegraph logs that required a restart for resolution.",01:33:00,00:13:00,01:20:00,Wikidata Query Service,Wikidata Query Service,"blazegraph,wdqs_80,wdqs_80,wdqs_80,PyBal","Databases, Web Servers & Application Layers, Load Balancers",There was a period of a few minutes where there was a full outage; all WDQS queries failed to complete during this window. There was a more extended period of degraded service where a subset of queries would fail depending on which instance received the request.,"Complete Service Outage, Partial Service Outage","The incident was due to 'bad queries' that were too taxing on the system, causing individual instances of blazegraph to go offline. Restarts were required to temporarily resolve the issue until problematic queries could be identified and blocked.","Database Issues, Capacity Overloads","The issue was first detected when a critical alert was issued and communicated through IRC, indicating that too many nodes were down, affecting full availability. The initial critical alerts that fired included 'PyBal backends health check on lvs2009', 'PyBal IPVS diff check on lvs2010', and 'PyBal backends health check on lvs2010'.",Service Probes and Health Checks Failures
112,2024-05-31_Image_hotlinking.wikitext,Hotlinking Caused Link Saturation in EQSIN Datacentre,2024-05-31 10:47:04,2024-05-31 10:47:04,2024-05-31 12:39:53,Sev(2),Hotlinking of an image on Commons caused link saturation in the eqsin datacentre.,01:52:49,00:00:00,01:52:49,eqsin,Content Delivery Network (CDN) and Edge Cache,"port utilisation,FastNetMon,varnish frontend rule","Monitoring & Telemetry, Networking Equipment, Caching Servers",Increase in response times for users using eqsin.,Elevated Response Times and Latencies,Hotlinking of an image on Commons caused link saturation in the eqsin datacentre.,Unexpected Traffic Surges,"The issue was first detected via paging for port utilisation in eqsin: Primary outbound port utilisation over 80%. Additionally, FastNetMon detected what it perceived as a DDoS attack.","Network Connectivity Problems, Security Vulnerabilities"
113,2021-10-29_graphite.wikitext,Graphite Metrics Backfill Failure During Bullseye Migration,2021-10-21 10:24:00,2021-10-26 16:50:00,2021-12-13 09:12:00,Sev(3),"The backfill process for Graphite metrics silently failed during the Bullseye migration, causing a subset of metrics to experience data loss for data points before October 11th 2021.",1270:48:00,126:26:00,1144:22:00,"Graphite,Grafana",Monitoring and Logging,"whisper-sync backfill process,Graphite hosts (graphite2003,Graphite hosts (graphite2003","Other, Monitoring & Telemetry",A subset of metrics experienced loss of data points before October 11th 2021 due to the failed backfill process.,Data Corruption or Loss,The whisper-sync backfill process failed undetected during the Bullseye migration.,Software Bugs,"Some Grafana dashboards backed by Graphite showed partial data for a subset of metrics, as reported by Lucas Werkmeister.","Cache Layer Anomalies, User Reported Problems"
114,2023-09-28_mw-page-content-change-enrich.wikitext,Incident with Mediawiki Page Content Change Enrichment,2023-09-28 14:33:00,2023-09-28 14:33:00,2023-10-03 14:14:54,Sev(2),"The mw-page-content-change Flink streaming enrichment job failed to produce messages to Kafka due to ongoing Kafka partition reassignment, causing a backlog of delayed messages over several days.",119:41:54,00:00:00,119:41:54,Mediawiki Event Enrichment,Other,"Kafka,Flink,Flink,Kafka,Kafka",Other,"No messages were lost, but they were delayed by several days.",Elevated Response Times and Latencies,"Copying Kafka partitions to new brokers, which starved broker threads and caused the mw-page-content-change Flink streaming enrichment job to fail in producing messages.",Other,"The first detection of the issue was through the MediawikiPageContentChangeEnrichJobManagerNotRunning alert, indicating that the job manager was not running.",Appserver Issues
115,2023-05-02_Phabricator_outage_during_GitLab_maintenance.wikitext,Phabricator Tasks Unloadable during GitLab Maintenance,2023-05-02 08:14:00,2023-05-02 08:14:00,2023-05-02 08:24:00,Sev(2),"During planned GitLab maintenance, Phabricator tasks failed to load for about 10 minutes, displaying an 'Unhandled Exception ('RuntimeException')' error.",00:10:00,00:00:00,00:10:00,"Version Control Tools,Version Control Tools",Other,"GitLabPatchesCustomField,toolpilot,toolpilot",Other,For approximately 10 minutes Phabricator tasks were not loading when GitLab was in maintenance mode.,Partial Service Outage,A Phabricator widget deployed in T324149 caused the issue during the GitLab maintenance.,Software Bugs,"The issue was first detected by users reporting in the #wikimedia-operations IRC channel, with no automated alerts as pages were loading but displaying an error instead of expected contents.",User Reported Problems
