,filename,title,incident_start_time,incident_detected_time,incident_end_time,severity_level,summary,incident_duration,time_to_detect,time_to_resolve,services,service_impact_type,components,component_root_cause,impact,user_impact_type,root_cause,category_root_cause,symptom,symptom_type
48,2019-09-20_d2_switch_failure.wikitext,Connectivity Loss Due to Switch Failure in Eqiad Rack D2,2023-10-20 23:57:00,2023-10-20 23:57:00,2023-10-21 02:15:00,Sev(3),"At 23:56 UTC on Friday 20th, the top of rack switch asw2-d2-eqiad went down causing all servers in rack D2 to go offline and brief connectivity loss for all row D servers. Some services remained degraded but eventually recovered.",02:18:00,00:00:00,02:18:00,"AQS,mobileapps,restbase,MW APIs,Logstash,Cloud NFS,Toolforge Kubernetes,Toolforge Kubernetes","API and Application Servers, API and Application Servers, Caching and Proxy Services, API and Application Servers, Monitoring and Logging, Media Storage and File Handling, Cloud Services and Virtual Private Servers (VPS), Cloud Services and Virtual Private Servers (VPS)","Top-of-Rack Switch,Virtual-chassis,Network Infrastructure,Row D,an-worker,an-worker,an-worker,an-worker,backup,cloudstore,cloudstore,cp,cp,flerovium,kafka,labstore,ms-be,ms-be,dbproxy,dbproxy,dbproxy","Networking Equipment, Other, Networking Equipment, Web Servers & Application Layers, Web Servers & Application Layers, Web Servers & Application Layers, Web Servers & Application Layers, Web Servers & Application Layers, Other, Web Servers & Application Layers, Web Servers & Application Layers, Caching Servers, Caching Servers, Other, Other, Web Servers & Application Layers, Web Servers & Application Layers, Databases, Databases, Databases","14 Hosts in D2 lost connectivity. Row D hosts experienced packet loss briefly. Some services such as AQS and mobileapps were impacted long after the initial blip. Logstash fell behind and threw many alerts. dbproxy1016 and dbproxy1017 failed health checks and switched to secondary choices. Cloud NFS clients lost access to specific services, and the maps Cloud VPS project lost NFS access until manual failover.","Network Connectivity Problems, Partial Service Outage, Elevated Response Times and Latencies","The immediate cause was a failure of the top of rack switch asw2-d2-eqiad, but the exact reason for the switch failure could not be determined.",Hardware Failures,"The first alert came from Icinga showing commons was down at 23:57 UTC, followed by an alert storm. The switch failure became apparent only after correlating alerts from Icinga and Netbox.",Network Connectivity Problems
49,2020-09-07_mobilefrontend-sec.wikitext,Stored XSS Security Issue on Talk Pages in MobileFrontend,,,,Sev(2),A stored XSS security issue was reported affecting talk pages in MobileFrontend and was patched the same day.,00:00:00,00:00:00,00:00:00,MobileFrontend,Other,talk pages,Other,Users accessing talk pages in MobileFrontend could have been exposed to malicious scripts due to the stored XSS issue.,Security Incidents,Stored XSS vulnerability in the talk pages of MobileFrontend.,Security Misconfigurations,The issue was reported and detected as a security vulnerability related to XSS in talk pages.,Security Vulnerabilities
50,2021-04-20_MediaWiki_API_slowdown.wikitext,Incident Report: Uncached Wiki Requests Instability,2023-09-01 07:31:00,2023-09-01 07:31:00,2023-09-01 08:16:00,Sev(2),"From approximately 7:31 to 8:16 UTC, there was instability serving Wiki uncached content, affecting authenticated users, bots, and POST requests. Most wikis experienced increased latencies and high levels of errors due to resource contention.",00:45:00,00:00:00,00:45:00,"Wiki uncached content,Authenticated users,Bots services,POST requests",Other,"service-wiki,service-servers,service-servers","Databases, Web Servers & Application Layers","Users experienced increased latencies (up to 5+ seconds) and a high level of errors, with approximately 1/4th of requests lost.","Elevated Response Times and Latencies, Increased Error Rates, Data Corruption or Loss","Excessive request rates from a bot caused overload on commonswiki requests, which blocked resources on most API and database servers, creating contention on other wikis.","Capacity Overloads, Unexpected Traffic Surges",The issue was first detected by increased latencies and high levels of errors within the system.,"Latency and Timeout Issues, High CPU & Resource Utilization"
51,2023-05-28_wikireplicas_lag.wikitext,Wikireplicas Data Unavailability Incident,2023-05-25 05:11:00,2023-05-25 05:11:16,2023-06-01 08:47:00,Sev(3),Wikireplicas experienced issues with outdated data and were unavailable for around one week due to a MariaDB replication bug.,171:36:00,00:00:16,171:35:44,"WMCS services,Database Replication,Database Replication","Cloud Services and Virtual Private Servers (VPS), Database and Data Analytics","MariaDB,db1154,db1154,clouddb1021,dbproxy1018,dbproxy1018","Databases, Web Proxies","Wikireplicas had outdated data and were unavailable for around one week, affecting tools most likely experienced intermittent unavailability or outdated data. Users complained about the lack of access to meta_p and heartbeat_p databases and slow query performance.","Partial Service Outage, Elevated Response Times and Latencies, Increased Error Rates, Storage and Database Failures",Replication of multiple sections broke most probably due to a bug in MariaDB version 10.4.29.,"Database Issues, Software Bugs","Replication lag was detected first by Icinga alerts, indicating critical replication issues on MariaDB replicas (s1 on db1154 and s2 on db1155).","Database Errors, Service Probes and Health Checks Failures"
52,2022-06-01_Lost_index_in_cloudelastic.wikitext,Cloudelastic Elasticsearch Data Loss Incident,2022-05-31 13:00:00,2022-05-31 13:00:00,2022-07-12 14:00:00,Sev(2),"During a reimage operation, the cloudelastic Elasticsearch cluster lost a shard and went into red status, indicating data loss. Restoration from production snapshots failed consistently, delaying the restoration by a month until it was completed on 12 July.",1009:00:00,00:00:00,1009:00:00,Cloudelastic,"Cloud Services and Virtual Private Servers (VPS), Search and Indexing","Elasticsearch cluster,Elasticsearch cluster,data restoration process",Other,"For 41 days, Cloudelastic was missing search results about files from commons.wikimedia.org.","Partial Service Outage, Data Corruption or Loss",The cloudelastic Elasticsearch cluster lost a shard during a reimage operation and restoration from production snapshots failed consistently.,"Database Issues, Software Bugs","The issue was first detected when the cloudelastic Elasticsearch cluster went into red status, indicating data loss.",Database Errors
53,2023-06-18_search_broken_on_wikidata_and_commons.wikitext,Search Broken on Wikidata and Commons - June 2023,2023-06-17 11:30:00,2023-06-17 22:07:00,2023-06-18 10:02:00,Sev(3),A reindexing task for Elasticsearch indices on Wikidata and Commons resulted in search failures due to a non-existent analyzer reference.,22:32:00,10:37:00,11:55:00,"Wikidata,Commons",Other,"Elasticsearch,Elasticsearch,Wikibase",Databases,Users could no longer perform searches on Wikidata and Commons during the outage period.,Partial Service Outage,The 'token_count_router' query was referencing a 'text_search' analyzer that had been de-duplicated and was no longer available.,Configuration Errors,The issue was first detected by users who reported the problem. It was further identified via increased CirrusSearch failures and confirmed with error messages indicating 'Unknown analyzer [text_search]'.,"User Reported Problems, Database Errors"
54,2019-08-07_s8-cawiki-errors.wikitext,DatabaseTermIdsResolver Misconfiguration in Wikidata,2019-08-07 17:26:00,2019-08-07 17:33:00,2019-08-07 19:17:00,Sev(2),"The table 'wb_terms' in 'wikidatawiki' used for label and description lookup of entities was replaced by 'TermStore'. A class called DatabaseTermIdsResolver picked the right host but used the wrong database name, leading to wrong database access.",01:51:00,00:07:00,01:44:00,"wiki,wiki,wiki",Other,"DatabaseTermIdsResolver,MediaWiki configuration,DatabaseTermIdsResolver",Other,"Some pages on 'cawiki' returned a 500 error due to failing to connect to the database. It potentially impacted all non-wikidata wikis, but 'cawiki' and 'ruwiki' use wikidata extensively enough for this to cause issues.","Partial Service Outage, Storage and Database Failures","DatabaseTermIdsResolver used the wrong database name ('cawiki' instead of 'wikidatawiki'), causing the code to try to get information from the wrong database.",Configuration Errors,We got the alert on IRC: PROBLEM - MediaWiki exceptions and fatals per minute on graphite1004 is CRITICAL: CRITICAL: 90.00% of data above the critical threshold [50.0],"Appserver Issues, User Reported Problems"
55,2022-10-06_eqiad_row_D_networking.wikitext,Partial Connectivity Outage in eqiad Row D,2022-10-07 14:50:00,2022-10-07 14:53:00,2022-10-07 14:52:00,Sev(2),"For 2 minutes, eqiad row D experienced a partial connectivity outage, impacting all types of clients. The automatic rollback restored full connectivity before manual recovery was needed.",00:02:00,00:03:00,23:59:00,"api-https,appserver,appserver,haproxy","API and Application Servers, Caching and Proxy Services","cr1-eqiad,cr1-eqiad,bast1003,dbproxy1016,dbproxy1016","Networking Equipment, Web Proxies","For 2 minutes eqiad row D suffered a partial connectivity outage, causing traffic through cr1-eqiad to be blackholed. This impacted all types of clients.","Partial Service Outage, Network Connectivity Problems",The configuration change on the cr1 discarded traffic towards the switch for unknown reasons.,Configuration Errors,"The issue was first detected when Ayounsi lost connectivity to cr1-eqiad and bast1003, followed by multiple alerts including high latency and service failures.","Network Connectivity Problems, Latency and Timeout Issues, Service Probes and Health Checks Failures"
56,2023-05-19 videoscaler jobrunner.wikitext,Incident on 2023-05-19 Involving Video Scaling and Jobrunner,2023-05-19 19:04:00,2023-05-19 19:24:00,2023-05-19 20:53:00,Sev(2),"A large video-scaling job caused server mw1469 to max out its capacity with ffmpeg processes, leading to flapping alerts for both jobrunner and videoscaler services.",01:49:00,00:20:00,01:29:00,"jobrunner,videoscaler","MediaWiki Core Services, Media Storage and File Handling","mw1469,mw1469,ffmpeg","Web Servers & Application Layers, Web Servers & Application Layers, Other",The user who uploaded those videos had to wait a bit longer to get different formats. Possibly other users waited a bit longer for other jobs.,Elevated Response Times and Latencies,A large video-scaling job made server mw1469 so busy that its capacity was maxed out by ffmpeg processes.,Capacity Overloads,"First detected by Icinga reporting via icinga-wm on IRC, followed by a page via Alertmanager.",Service Probes and Health Checks Failures
57,2024-06-10_puppet_volatile_data_broken_sync.wikitext,Puppet Rsync Client Hanging Incident,2024-04-27 00:00:00,2024-04-27 00:00:00,2024-04-27 00:06:00,Sev(2),"Between 2024-04-27 00:00 and 2024-04-27 00:08 UTC, the rsync clients of most puppetmasters/puppetservers to sync data from puppetmaster1001 hung indefinitely. On 2024-06-10, they were killed and restarted manually.",00:06:00,00:00:00,00:06:00,"puppet,CheckUser,Analytics",Other,"puppetmaster1001,puppetmaster1001,GeoLite2 files,puppetmaster1001",Other,"New data from puppet 'volatile' was only rarely/intermittently synced to much of the fleet during this window. The problem was particularly bad in codfw, where all 3 puppetservers had failed to rsync data for the entire duration. The impact is uncertain because, aside from one service, no one noticed any issues.","Partial Service Outage, Data Corruption or Loss","Infinite timeouts were allowed, causing rsync clients to hang indefinitely. Monitoring and logging were disabled, preventing alerting/notification on sync failures. The issue arose from a deadlock situation in the select() call for the rsync client sockets.","Configuration Errors, Software Bugs","Manual detection by Kosta Harlan, who noticed the absence of new GeoLite2 files while working on a task. The missing files were confirmed by cdanis during an investigation initiated from an inquiry on the #wikimedia-sre-foundations IRC channel.",Other
58,2020-02-06_mediawiki.wikitext,Widespread service timeouts following group2 wikis update,2020-02-06 20:22:00,2020-02-06 20:24:00,2020-02-06 20:52:00,Sev(4),Widespread service timeouts starting immediately after moving group2 wikis to 1.35.0-wmf.18. Reverting to 1.35.0-wmf.16 immediately brought most services back to life.,00:30:00,00:02:00,00:28:00,"Other,Other,Other","MediaWiki Core Services, Monitoring and Logging, API and Application Servers","wikifeeds,Apache HTTP on mw servers,eqiad appservers,Apache HTTP on mw servers,eqiad appservers","Web Servers & Application Layers, Caching Servers, Web Servers & Application Layers, Web Servers & Application Layers, Databases","All sites were unresponsive or at least partially offline for ~8 minutes. (Except for cache hits, which would be 'popular' pages for non-logged-in users.)","Complete Service Outage, Partial Service Outage",A typo in a config setting for Wikibase.,Configuration Errors,~100% of icinga alerts fired simultaneously.,"Service Probes and Health Checks Failures, Network Connectivity Problems"
59,2021-11-02_Cloud_VPS_networking.wikitext,2021-11-02 Cloud VPS networking,2021-11-02 11:35:00,,2021-11-02 13:20:00,Sev(2),"For about 1 hour and 40 minutes, Toolforge services and VMs in Cloud VPS may have experienced connectivity issues.",01:45:00,00:00:00,00:00:00,"Toolforge,Cloud VPS",Cloud Services and Virtual Private Servers (VPS),"cloudnet,cloudnet,Toolforge NFS in Kubernetes,LDAP connections,cloudnet",Other,"For about 1 hour and 40 minutes, Toolforge services and VMs in Cloud VPS may have experienced connectivity issues.",Network Connectivity Problems,The issue was caused by a kernel upgrade for several Cloud VPS network components that affected ingress traffic to the network edge for cloud VMs.,Configuration Errors,"Problems were initially detected with Toolforge NFS in Kubernetes and later with LDAP connections. Eventually, it was determined to be a problem with all ingress traffic to the network edge for cloud VMs.",Network Connectivity Problems
60,2020-08-12_appservers_oom.wikitext,Incident Report for T260329,,,,Sev(2),Restricted. Details at https://phabricator.wikimedia.org/T260329.,00:00:00,00:00:00,00:00:00,Restricted,Other,,Other,,Other,,Other,,Other
61,2022-05-20_Database_slow.wikitext,High Latency and Unavailability due to Application Server Worker Thread Exhaustion,2022-05-20 09:35:00,2022-05-20 09:35:00,2022-05-20 09:35:00,Sev(3),"On 2022-05-14 and 2022-05-20, there were incidents of high latency and unavailability due to application server worker thread exhaustion caused by slow database responses.",00:00:00,00:00:00,00:00:00,uncached traffic,Caching and Proxy Services,"application server,database","Web Servers & Application Layers, Databases",Two occurrences of impact on uncached traffic resulting in high latency and unavailability.,"Partial Service Outage, Elevated Response Times and Latencies, Cache Issues",MariaDB 10.6 performance regression under load.,"Database Issues, Software Bugs","Detected through 3 and 5-minute impacts on uncached traffic with high latency and unavailability, first noticed on 2022-05-14 at 8:18 UTC and again on 2022-05-20 at 09:35 UTC.","Latency and Timeout Issues, Cache Layer Anomalies"
62,2020-09-02_wdqs-outage.wikitext,Wikidata Query Service Outage Incident 20200902,2020-09-02 20:34:00,2020-09-02 20:42:31,2020-09-02 22:27:00,Sev(2),"Active Wikidata Query Service instances were down due to Blazegraph being 'locked up', causing queries to time out and exceed nginx's timeout window.",01:53:00,00:08:31,01:44:29,Wikidata Query Service,Wikidata Query Service,"Blazegraph,nginx","Databases, Web Servers & Application Layers","Intermittent service disruption occurred between 20:34 and 22:27 UTC, with about 75% of the time in a state of total outage.","Complete Service Outage, Partial Service Outage","Blazegraph received malformed queries, which triggered deadlocks leading to service unavailability.",Software Bugs,"Issue was first detected when a critical alert from PyBal backends health check was issued at 20:42 UTC, indicating multiple servers being marked down.","Service Probes and Health Checks Failures, Network Connectivity Problems"
63,2022-12-09_MediaWiki_REST_API.wikitext,REST API Content Versioning Issue on MediaWiki,2022-12-06 12:27:18,2022-12-08 23:30:00,2022-12-09 02:39:00,Sev(2),"A change in the MediaWiki REST API caused requests for old revisions to serve the current revision, detected due to visual diffs indicating no changes.",62:11:42,59:02:42,03:09:00,"MediaWiki,VisualEditor",MediaWiki Core Services,"MediaWiki REST API,MediaWiki REST API,MediaWiki REST API",Web Servers & Application Layers,"Visual diffs showed no changes (common feature, approx. 100,000 users of the beta feature on enwiki), and editing old revisions using the VisualEditor did not work (rare occurrence).",Partial Service Outage,A refactoring in the MediaWiki REST API caused it to incorrectly serve the current revision when old revisions were requested.,Software Bugs,The issue was first detected manually by observing that visual diffs indicated no changes had occurred.,User Reported Problems
64,2020-10-30_fr.wikipedia.org-slow-main-page.wikitext,"French Wikipedia Main Page Slow Loading Incident - October 30, 2020",2020-10-30 12:22:00,2020-10-30 17:40:00,2020-10-30 18:56:00,Sev(2),"The main page of the French Wikipedia was loading significantly slower than usual on October 30th, 2020, with load times of up to 20 seconds for logged-in users.",06:34:00,05:18:00,01:16:00,Wikipedia,Other,"FeaturedFeeds extension,Memcached",Other,Logged-in users of the French Wikipedia experienced slow load times of several seconds to up to 20 seconds. Logged-out users were not affected due to their pages being served from cache.,"Elevated Response Times and Latencies, Cache Issues","The FeaturedFeeds extension was generating and parsing the entire feed on every main page load because the feed size exceeded the memcached limit, resulting in 'ITEM_TOO_BIG' errors.","Capacity Overloads, Software Bugs",The issue was first detected when users started reporting the slow load times on the French Wikipedia Bistro page and a ticket was created on Phabricator.,"User Reported Problems, Latency and Timeout Issues"
65,2020-02-25_mediawiki_interface_language.wikitext,Configuration Change Caused UI Language Issue,2020-02-24 00:53:00,2020-02-24 08:41:00,2020-02-24 14:35:00,Sev(2),Logged-out users saw the user interface in their browser language rather than the default wiki content language due to a configuration change causing the $wgULSLanguageDetection setting to be unset.,13:42:00,07:48:00,05:54:00,"UniversalLanguageSelector,appserver","Other, API and Application Servers","$wgULSLanguageDetection,InitialiseSettings.php,InitialiseSettings.php",Other,"Anonymous users were affected, registered users were not. Appserver load increased due to cache splitting by Accept-Language, and average response time also went up considerably.","Partial Service Outage, Elevated Response Times and Latencies, Cache Issues",A configuration change inadvertently causing the $wgULSLanguageDetection setting to be unset and falling back to the default in the UniversalLanguageSelector extension.,Configuration Errors,Reported by users on Phabricator (T246071) and other tasks. There were no alerts.,User Reported Problems
66,2022-07-03_shellbox_request_spike.wikitext,Shellbox Service Incident Report,2022-07-03 11:17:00,2022-07-03 11:17:00,2022-07-03 11:33:00,Sev(2),"An increase in Score requests overwhelmed the Shellbox service, causing slow or unavailable edits and previews for pages with musical notes for 16 minutes.",00:16:00,00:00:00,00:16:00,"Shellbox,Parsoid",MediaWiki Core Services,"Score extension,k8s pods","Containers & Kubernetes, Other","For 16 minutes, edits and previews for pages with Score musical notes were too slow or unavailable.","Partial Service Outage, Elevated Response Times and Latencies",An increase in Score requests (musical note rendering) from Parsoid overwhelmed the Shellbox service.,"Capacity Overloads, Unexpected Traffic Surges","The issue was first detected from Grafana and Logstash dashboards showing a significant increase in request times and errors, including HTTP 503 and HTTP 504.","Latency and Timeout Issues, Network Connectivity Problems"
67,2023-07-19_enrich_job_outage.wikitext,Incident involving mw-page-content-change-enrich application outage on 2023-07-19,2023-07-19 18:50:30,2023-07-19 20:10:38,2023-07-19 20:30:00,Sev(2),"An enriched message exceeding Kafka's max.request.size caused the mw-page-content-change-enrich application's Kafka producer to crash, resulting in a Flink Taskmanager shutdown.",01:39:30,01:20:08,00:19:22,mw-page-content-change-enrich application,MediaWiki Core Services,"Flink Taskmanager,Kafka producer",Other,The mw-page-content-change-enrich application (eqiad) has not been producing enriched events during the outage.,Partial Service Outage,An enriched message exceeding Kafka's max.request.size caused the application's Kafka producer to crash.,Configuration Errors,GModena and TChin reacted to alerts triggered by degrading Service Level Indicators (SLIs).,"Latency and Timeout Issues, User Reported Problems"
68,2020-05-01_vc-link-failure.wikitext,Virtual Chassis Link Failure Between asw2-d1-eqiad and asw2-d8-eqiad,2023-10-01 05:21:00,2023-10-01 05:21:00,2023-10-02 07:08:00,Sev(2),"The virtual chassis link between asw2-d1-eqiad and asw2-d8-eqiad failed in two steps, causing packet loss for hosts on D1 and connectivity issues between MediaWiki appservers and memcache servers.",25:47:00,00:00:00,25:47:00,"appservers,servers,servers","API and Application Servers, Caching and Proxy Services","asw2-d1-eqiad,asw2-d1-eqiad,mw1356-1362","Networking Equipment, Web Servers & Application Layers","Little to no effect on traffic, error rates, and latencies for anonymous users. Logged in users experienced a ~1% error rate increase (with a short spike to ~7.5%) and increased tail latency (around 100%-150% increase).","Partial Service Outage, Elevated Response Times and Latencies, Increased Error Rates","Packet loss through Virtual Chassis Fabric, particularly between asw2-d1-eqiad and asw2-d8-eqiad.",Network Failures,"Detected by critical alerts from icinga-wm for MediaWiki exceptions and fatals per minute, and MediaWiki memcached error rate, followed by critical alerts for PHP7 rendering with socket timeouts.","Appserver Issues, Latency and Timeout Issues, Cache Layer Anomalies"
69,2023-05-23_wdqs_CODFW_5xx_errors.wikitext,WDQS Service Outage in CODFW Datacenter,2023-05-23 10:48:00,2023-05-23 10:47:00,2023-05-23 19:24:00,Sev(3),An expensive query repeatedly sent by an external user caused errors and timeouts for a subset of users accessing the WDQS service from the CODFW datacenter. A requestctl rule was implemented to mitigate the issue.,08:36:00,23:59:00,08:37:00,WDQS service,Wikidata Query Service,"PyBal backends,lvs2010,wdqs-heavy-queries_8888,wdqs-heavy-queries_8888","Load Balancers, Load Balancers, Web Servers & Application Layers, Databases",A subset of users accessing the WDQS service from our CODFW datacenter received errors and timeouts.,"Partial Service Outage, Increased Error Rates, Network Connectivity Problems",An expensive query sent over and over again by an external user(s) caused the issue.,Unexpected Traffic Surges,"First Icinga alerts fired at 10:47 UTC, indicating 'PyBal backends health check on lvs2010 is CRITICAL: PYBAL CRITICAL - CRITICAL - wdqs-heavy-queries_8888: Servers wdqs2009.codfw.wmnet are marked down but pooled'.",Service Probes and Health Checks Failures
70,2021-07-14_eventgate-analytics_latency_spike_caused_MW_app_server_overload.wikitext,EventGate Deployment Caused MediaWiki API Request Failures,2021-07-14 16:07:12,2021-07-14 16:07:12,2021-07-14 16:17:18,Sev(2),"During the deployment of updates to EventGate for Prometheus support, a spike in request latency from MediaWiki to eventgate-analytics caused some MediaWiki API requests to fail, leading to an auto-rollback of the deployment in codfw.",00:10:06,00:00:00,00:10:06,"MediaWiki API,EventGate,EventGate","API and Application Servers, Monitoring and Logging","php worker,node-rdkafka-prometheus,service-template-node,service-template-node,helm,node-rdkafka-prometheus","Web Servers & Application Layers, Monitoring & Telemetry, Containers & Kubernetes, Web Servers & Application Layers, Cluster Management, Monitoring & Telemetry","For ~10 minutes, MediaWiki API clients experienced request failures.",API Failures,A bug in the service-runner Prometheus integration caused the nodejs worker process to die when 'prom-client' was required within a worker.,Software Bugs,"Request latency spikes from MediaWiki to eventgate-analytics were detected, filling PHP worker slots and causing MediaWiki API request failures. Helm auto-rolled back the deployment after detecting issues with the eventgate-analytics deploy to codfw.","Latency and Timeout Issues, High CPU & Resource Utilization, Service Probes and Health Checks Failures"
